{
  "schemaVersion": "1.0.0",
  "demo": "demo-a",
  "codexVersion": "0.146.0-alpha.3",
  "requestedModel": null,
  "observedModel": null,
  "modelLimitation": "Codex JSONL did not expose the default model name; all successful demo sessions used the same default configuration.",
  "commandCount": 10,
  "commandKinds": {
    "build": 2,
    "inspect": 1,
    "lint": 1,
    "read": 4,
    "search": 1,
    "static-acceptance": 1
  },
  "readCommandCount": 4,
  "searchCommandCount": 1,
  "lintCommandObserved": true,
  "buildCommandObserved": true,
  "sessionUsage": {
    "input_tokens": 380201,
    "cached_input_tokens": 355584,
    "cache_write_input_tokens": 0,
    "output_tokens": 5174,
    "reasoning_output_tokens": 2471
  },
  "finalSha256": "sha256:629f8e264e0833dd306382c2e3e8db5c11504191f440c791eb10be81b2d9e5c1",
  "limitations": [
    "Command counts are derived from Codex command_execution events, not wall-clock process tracing.",
    "Files read through a compound shell command are counted as one read command.",
    "Raw events and final Agent text are private evaluation evidence and may contain machine paths."
  ]
}
